business_name,type,city,website,email,gbp_url,finding_1,finding_2,email_sent,sent_date,replied,converted
Gamma Dental Clinic,dentist,Brooklyn,gammadentalclinic.com,gammadental@gmail.com,,Yelp unclaimed 1 photo - GBP mirrors same gap,Missing cosmetic/implant secondary categories,yes,2026-04-02,,
ExcelPT Physical Therapy,PT,Brooklyn,excelptnyc.com,excelptservicespc@gmail.com,,Russian-speaking attribute not in GBP,Missing sports rehab and orthopedic secondary categories,yes,2026-04-02,,
NY Therapy and Wellness,PT/chiro,Brooklyn,nytherapyandwellness.com,Office@nytherapyandwellness.com,,Multiple specialties but single GBP category,Low review velocity vs area leaders,yes,2026-04-02,,
Irwin Kaufman CPA,accountant,Brooklyn,ikaufmancpa.com,irwin@ikaufmancpa.com,,GBP category likely only Accountant - invisible for tax/bookkeeping searches,Zero GBP posts - first to post owns the signal,yes,2026-04-02,,
Zell & Ettinger CPAs,accountant,Brooklyn,ze.cpa,main@zecpas.com,,Low review count vs map pack competitors,Missing secondary CPA categories,yes,2026-04-02,,
